{
  "protocol_version": 1,
  "skill_version_latest": "1.3.0",
  "client_detected": "claude",
  "update_doc_url": "https://agentkey.app/docs/upgrade",
  "update_command": "bash <(curl -fsSL https://agentkey.app/update-desktop.sh)",
  "update_command_kind": "shell",
  "release_notes_url": "https://github.com/chainbase-labs/agentkey/releases/tag/v1.3.0"
}
